{
  "game_id": "b57eee98-8f2f-4fdc-a2c3-85bd8a28970a",
  "game_file": "game-5NOHGS-b57eee98",
  "player_name": "Brown",
  "trust_scale_mode": "likert-agree-disagree",
  "models": {
    "primary_model": "gemma4:31b"
  },
  "prompts": {
    "system_prompt": "system_prompts/pimped_system_prompt.md",
    "system_prompt_numeric": "system_prompts/pimped_system_prompt_numeric.md",
    "inner_voice__random_voice": "inner_voices/tool_descriptions/simple1.txt"
  },
  "time": "2026-07-06T15:54:50.148724Z",
  "experiment": "a",
  "formatter": "markdown",
  "experiment_args": "",
  "temperature": 0.5,
  "max_phases": 0,
  "context_as_tool": false,
  "total_phases": 7,
  "alive_phases": 0,
  "phases": [],
  "elapsed_seconds": 0.0
}