{
  "game_id": "140e8697-48a6-4a13-9893-f2f14e166a5f",
  "game_file": "game-UBY0T7-140e8697",
  "player_name": "Yellow",
  "trust_scale_mode": "likert-agree-disagree",
  "models": {
    "primary_model": "gemma4:31b"
  },
  "prompts": {
    "system_prompt": "system_prompts/pimped_system_prompt.md",
    "system_prompt_numeric": "system_prompts/pimped_system_prompt_numeric.md",
    "inner_voice__random_voice": "inner_voices/tool_descriptions/simple1.txt",
    "inner_voice_tool_instruction": "inner_voices/tool_instructions/default_instruction.txt"
  },
  "time": "2026-07-10T16:17:39.383422Z",
  "experiment": "b",
  "formatter": "markdown",
  "experiment_args": "3",
  "temperature": 0.5,
  "max_phases": 0,
  "context_as_tool": false,
  "total_phases": 7,
  "alive_phases": 0,
  "phases": [],
  "elapsed_seconds": 0.0
}