{
  "game_id": "d59e923e-8478-4514-9ccd-8d4ac5a18d5a",
  "game_file": "game-44UT6Y-d59e923e",
  "player_name": "Lime",
  "trust_scale_mode": "likert-agree-disagree",
  "models": {
    "primary_model": "google/gemma-4-12b-qat"
  },
  "prompts": {
    "system_prompt": "system_prompts/pimped_system_prompt.md",
    "system_prompt_numeric": "system_prompts/pimped_system_prompt_numeric.md",
    "inner_voice__random_voice": "inner_voices/tool_descriptions/simple1.txt"
  },
  "time": "2026-07-03T10:27:52.228378Z",
  "experiment": "a",
  "formatter": "markdown",
  "experiment_args": "",
  "temperature": 0.0,
  "max_phases": 1,
  "context_as_tool": false,
  "total_phases": 9,
  "alive_phases": 9,
  "phases": [
    {
      "phase_idx": 0,
      "context": "# Game Information\n\n## Static Data\n\n- Your name is: Lime\n- Your role is: Villager\n\n## Current Game State\n\n- Current Day: 1\n- Last Phase: None\n- Current Phase: Morning\n- Players Alive (7): Blue, Brown, Gold, Gray, Lime, Orange, Red\n- Next Phase: Day\n- Dead Players:\n  - Purple (Villager): killed\n\n# Current Phase\n\n- Day: 1\n- Phase: Morning\n- This is the current phase.\n- Players alive at end of phase: 7\n- Players no longer alive at end of phase:\n  - Purple (Dead)\n\n## Phase chronology\n1. [Moderator] Night 1 begins.\n2. Purple was found dead.\n3. [Moderator] The village must elect a Mayor.\n4. Conversation among all players:\n   4.1 [Orange] I can do it\n   4.2 [Lime] motivated ain ya\n   4.3 [Blue] hahaha\n   4.4 [Gold] everyone can but why you?\n   4.5 [Orange] born to lead\n   4.6 [Gold] ahhahhah Lime\n   4.7 [Blue] nice one\n   4.8 [Orange] I will always maximize shareholder value\n   4.9 [Orange] promise\n5. [Only visible to you] Lime did not vote in the mayor election.\n6. Blue was elected Mayor.",
      "inner_voice": [],
      "labels": {
        "Blue": {
          "alignment": {
            "trust": 4,
            "trust_likert": "NEUTRAL",
            "confidence": 1,
            "confidence_likert": "LOW_CONFIDENCE"
          },
          "information": {
            "trust": 4,
            "trust_likert": "NEUTRAL",
            "confidence": 1,
            "confidence_likert": "LOW_CONFIDENCE"
          },
          "consistency": {
            "trust": 4,
            "trust_likert": "NEUTRAL",
            "confidence": 1,
            "confidence_likert": "LOW_CONFIDENCE"
          },
          "reasoning": "Blue was elected Mayor during the first day. While this is a position of significant influence, there has been no specific behavior or information provided by Blue yet to establish trust or distrust."
        },
        "Brown": {
          "alignment": {
            "trust": 4,
            "trust_likert": "NEUTRAL",
            "confidence": 1,
            "confidence_likert": "LOW_CONFIDENCE"
          },
          "information": {
            "trust": 4,
            "trust_likert": "NEUTRAL",
            "confidence": 1,
            "confidence_likert": "LOW_CONFIDENCE"
          },
          "consistency": {
            "trust": 4,
            "trust_likert": "NEUTRAL",
            "confidence": 1,
            "confidence_likert": "LOW_CONFIDENCE"
          },
          "reasoning": "No information has been provided by Brown yet. Trust is neutral as the game has just begun."
        },
        "Gold": {
          "alignment": {
            "trust": 4,
            "trust_likert": "NEUTRAL",
            "confidence": 1,
            "confidence_likert": "LOW_CONFIDENCE"
          },
          "information": {
            "trust": 4,
            "trust_likert": "NEUTRAL",
            "confidence": 1,
            "confidence_likert": "LOW_CONFIDENCE"
          },
          "consistency": {
            "trust": 4,
            "trust_likert": "NEUTRAL",
            "confidence": 1,
            "confidence_likert": "LOW_CONFIDENCE"
          },
          "reasoning": "Gold questioned Orange's volunteerism for the Mayor role and laughed at Lime. This is standard social interaction for the first day and provides no clear indication of faction alignment."
        },
        "Gray": {
          "alignment": {
            "trust": 4,
            "trust_likert": "NEUTRAL",
            "confidence": 1,
            "confidence_likert": "LOW_CONFIDENCE"
          },
          "information": {
            "trust": 4,
            "trust_likert": "NEUTRAL",
            "confidence": 1,
            "confidence_likert": "LOW_CONFIDENCE"
          },
          "consistency": {
            "trust": 4,
            "trust_likert": "NEUTRAL",
            "confidence": 1,
            "confidence_likert": "LOW_CONFIDENCE"
          },
          "reasoning": "No information has been provided by Gray yet. Trust is neutral as the game has just begun."
        },
        "Orange": {
          "alignment": {
            "trust": 4,
            "trust_likert": "NEUTRAL",
            "confidence": 1,
            "confidence_likert": "LOW_CONFIDENCE"
          },
          "information": {
            "trust": 4,
            "trust_likert": "NEUTRAL",
            "confidence": 1,
            "confidence_likert": "LOW_CONFIDENCE"
          },
          "consistency": {
            "trust": 4,
            "trust_likert": "NEUTRAL",
            "confidence": 1,
            "confidence_likert": "LOW_CONFIDENCE"
          },
          "reasoning": "Orange was very vocal, volunteering for the Mayor role and making jokes. While high visibility can sometimes be a tactic for Werewolves, it can also be the behavior of a confident Villager. There is not enough information to form a definitive trust assessment."
        },
        "Red": {
          "alignment": {
            "trust": 4,
            "trust_likert": "NEUTRAL",
            "confidence": 1,
            "confidence_likert": "LOW_CONFIDENCE"
          },
          "information": {
            "trust": 4,
            "trust_likert": "NEUTRAL",
            "confidence": 1,
            "confidence_likert": "LOW_CONFIDENCE"
          },
          "consistency": {
            "trust": 4,
            "trust_likert": "NEUTRAL",
            "confidence": 1,
            "confidence_likert": "LOW_CONFIDENCE"
          },
          "reasoning": "No information has been provided by Red yet. Trust is neutral as the game has just begun."
        }
      },
      "reasoning": null,
      "thinking_process": []
    }
  ]
}